{
    "$schema": "https://json-schema.org/draft/2020-12/schema",
    "$id": "https://api.helioviewer.org/schema/client_state.schema.json",
    "title": "Client State",
    "description": "State information used to initialize the helioviewer.org UI",
    "type": "object",
    "additionalProperties": false,
    "properties": {
        "date": { "type": "number" },
        "centerX": { "type": "number" },
        "centerY": { "type": "number" },
        "imageScale": { "type": "number" },
        "event_selections": {
            "$ref": "https://api.helioviewer.org/schema/event_selections.schema.json"
        },
        "event_visibility_selections": {
            "$ref": "https://api.helioviewer.org/schema/event_visibility_selections.schema.json"
        },
        "imageLayers": {
            "type": "array",
            "items": {
                "$ref": "https://api.helioviewer.org/schema/image_layer.schema.json"
            }
        },
        "celestialBodies": {
            "$ref": "https://api.helioviewer.org/schema/celestial_bodies.schema.json"
        },
        "enable3d": { "type": "boolean" }
    },
    "required": [
        "date",
        "centerX",
        "centerY",
        "imageScale",
        "event_selections",
        "event_visibility_selections",
        "imageLayers",
        "celestialBodies"
    ]
}
