{
    "date": 1410269529000,
    "imageScale": 4.84088176,
    "centerX": -2894.0322215830834,
    "centerY": 101.72638697583727,
    "imageLayers": [
        {
            "end": "2024-07-29 17:33:45",
            "start": "2010-06-02 00:05:36",
            "opacity": 100,
            "visible": true,
            "diffTime": 1,
            "nickname": "AIA 171",
            "sourceId": 10,
            "uiLabels": [
                {
                    "label": "Observatory",
                    "name": "SDO"
                },
                {
                    "label": "Instrument",
                    "name": "AIA"
                },
                {
                    "label": "Measurement",
                    "name": "171"
                }
            ],
            "diffCount": 60,
            "Instrument": "AIA",
            "difference": 0,
            "Measurement": "171",
            "Observatory": "SDO",
            "baseDiffTime": "2024-07-19T13:28:50.000Z",
            "layeringOrder": 1
        }
    ],
    "event_selections": [
        "HEK>>Active Region>>HMI_SHARP",
        "HEK>>Active Region>>HMI SHARP",
        "HEK>>Active Region>>NOAA_SWPC_Observer",
        "HEK>>Active Region>>NOAA SWPC Observer",
        "HEK>>Active Region>>SPoCA",
        "HEK>>Coronal Cavity",
        "HEK>>Coronal Dimming",
        "HEK>>Coronal Hole>>SPoCA",
        "HEK>>Coronal Jet",
        "HEK>>CME",
        "HEK>>Coronal Rain",
        "HEK>>Coronal Wave",
        "HEK>>Emerging Flux>>Emerging_flux_region_module",
        "HEK>>Emerging Flux>>Emerging flux region module",
        "HEK>>Eruption",
        "HEK>>Filament",
        "HEK>>Filament Activation",
        "HEK>>Filament Eruption",
        "HEK>>Flare",
        "HEK>>Loop",
        "HEK>>Oscillation",
        "HEK>>Plage",
        "HEK>>Sigmoid>>Sigmoid_Sniffer",
        "HEK>>Sigmoid>>Sigmoid Sniffer",
        "HEK>>Spray Surge",
        "HEK>>Sunspot>>EGSO_SFC",
        "HEK>>Sunspot>>EGSO SFC",
        "HEK>>Topological Object>>SSW_PFSS_v2_\\+_null_point_finder_v20180808",
        "HEK>>Topological Object>>SSW PFSS v2 \\+ null point finder v20180808",
        "CCMC>>DONKI>>CME",
        "CCMC>>Solar Flare Predictions>>MAG4_LoS_FEr",
        "CCMC>>Solar Flare Predictions>>MAG4 LoS FEr"
    ],
    "event_visibility_selections": {
        "HEK": {
            "marker_visibility": true,
            "label_visibility": true
        },
        "CCMC": {
            "marker_visibility": true,
            "label_visibility": true
        },
        "RHESSI": {
            "marker_visibility": true,
            "label_visibility": true
        },
        "WSA": {
            "marker_visibility": true,
            "label_visibility": true
        }
    },
    "celestialBodies": {
        "soho": [],
        "stereo_a": [
            "stereo_a-mercury-tree-label"
        ],
        "stereo_b": []
    }
}
